{"schema":"ai-news-status/1","schemaVersion":1,"generatedAt":"2026-10-24T19:36:34Z","windowDays":7,"providers":[{"id":"openai-status","name":"OpenAI status","company":"OpenAI","url":"https://status.openai.com","incidents":[{"id":"7cd57ab93ffc1809","title":"Degraded experience with ChatGPT app connections using CIMD","url":"https://status.openai.com//incidents/01M5NFF94XCJ6CGTD4S78A9BEB","publishedAt":"2026-10-23T23:43:22.000Z","summary":"Status: Resolved All impacted services have now fully recovered. Affected components Connectors/Apps (Operational)"},{"id":"278a47902d314292","title":"Help Center Chat Support Degraded","url":"https://status.openai.com//incidents/01M5NAR5GZC5M7D0S7AQ6CGEEN","publishedAt":"2026-10-23T22:02:57.000Z","summary":"Status: Resolved All impacted services have now fully recovered."},{"id":"d53d450b357e6118","title":"Delays in customer support responses","url":"https://status.openai.com//incidents/01M5KDJ4079XQTZDSRX40NMN6H","publishedAt":"2026-10-23T05:58:06.000Z","summary":"Status: Resolved All impacted services have now fully recovered."},{"id":"cc5c49f2994be3f7","title":"New Ad Accounts failing to provision admins","url":"https://status.openai.com//incidents/01M5JHVJVC8WAXB4WRYFMKG6HP","publishedAt":"2026-10-23T00:07:55.000Z","summary":"Status: Resolved All impacted services have now fully recovered. Affected components Ads Manager (Operational) Ads API (Operational)"},{"id":"493b0829d10b920f","title":"Degraded Performance of Dots on Enterprise","url":"https://status.openai.com//incidents/01M5JF8DR3EGQJNTXPZ24AKX2G","publishedAt":"2026-10-22T20:55:48.000Z","summary":"Status: Resolved All impacted services have now fully recovered. Affected components dots (Operational)"},{"id":"d700037c98b1a977","title":"Elevated ChatGPT conversation and Responses API errors","url":"https://status.openai.com//incidents/01M5GPE9C4E19HE461P8JAMYXD","publishedAt":"2026-10-22T08:50:43.000Z","summary":"Status: Resolved All impacted services have now fully recovered. Affected components Conversations (Operational) Responses (Operational)"},{"id":"8e7980c6d96dbafb","title":"Elevated FedRAMP API error rates for Astra and Sol","url":"https://status.openai.com//incidents/01M5FD63HHDRPQPM5YMQWJ5HTN","publishedAt":"2026-10-21T19:34:58.000Z","summary":"Status: Resolved All impacted services have now fully recovered. Affected components FedRAMP (Operational)"},{"id":"d04bbbd36a8792c4","title":"Elevated error rates for gpt-5.6-luna API requests","url":"https://status.openai.com//incidents/01M5FHKHPQJMSHCE2B2WDPZW2N","publishedAt":"2026-10-21T16:44:09.000Z","summary":"Status: Resolved All impacted services have now fully recovered. Affected components Chat Completions (Operational) Responses (Operational)"},{"id":"4d84fb884e681947","title":"Degraded performance in ChatGPT, Codex, and APIs","url":"https://status.openai.com//incidents/01M5E4G39TD1BW1QWHZG6RFA5H","publishedAt":"2026-10-21T03:28:00.000Z","summary":"Status: Resolved All impacted services have now fully recovered. Affected components Chat Completions (Operational) Audio (Operational) Responses (Operational) Agent (Operational) Images (Operational) Realtime (Operational) Embeddings (Operational) Moderations (Operational)…"},{"id":"ddb42cc3159935fb","title":"Authentication errors for some users","url":"https://status.openai.com//incidents/01M5G9QQ9V4CYDWFRYF9BWZ5GG","publishedAt":"2026-10-20T17:35:00.000Z","summary":"Status: Resolved On October 20, from 9:35 to 10:35 a.m. PDT, some users near Illinois experienced authentication errors with the API, ChatGPT, and Codex. We rolled back a configuration change, and service was restored. Affected components Login (Operational)"},{"id":"18541f39d00965ca","title":"File Download errors","url":"https://status.openai.com//incidents/01M5A5S1ATN3QB2WCHQ3VDZC81","publishedAt":"2026-10-19T14:14:03.000Z","summary":"Status: Resolved All impacted services have now fully recovered. Affected components Image Generation (Operational) File uploads (Operational) Images (Operational) Files (Operational) Responses (Operational)"}]},{"id":"claude-status","name":"Claude status","company":"Anthropic","url":"https://status.claude.com","incidents":[{"id":"62f5e8760e0e905b","title":"Elevated errors for Claude Fable 5 and Claude Fable 5.1","url":"https://status.claude.com/incidents/0ns5clsk8p2x","publishedAt":"2026-10-24T05:53:30.000Z","summary":"Oct 24 , 05:53 UTC Resolved - The issue affecting Claude services has been resolved. Impact occurred from 22:00 PT on October 23 / 05:00 UTC on October 24 to 22:35 PT on October 23 / 05:35 UTC on October 24. Oct 24 , 05:41 UTC Monitoring - A fix has been deployed for the issue…"},{"id":"4e536df3317e63e2","title":"Elevated errors for Claude Opus 5.5","url":"https://status.claude.com/incidents/3cqf3pmlnr96","publishedAt":"2026-10-24T00:37:17.000Z","summary":"Oct 24 , 00:37 UTC Resolved - The issue affecting Claude Opus 5.5 has been resolved. Impact occurred from 17:23 PT on October 23 / 00:23 UTC on October 24 to 17:34 PT on October 23 / 00:34 UTC on October 24. Oct 24 , 00:31 UTC Investigating - We are investigating elevated…"},{"id":"359d07fefebc2f63","title":"Elevated errors for Claude Fable 5.1, Sonnet 5.5, and Haiku 5.5","url":"https://status.claude.com/incidents/h101vcmhnfky","publishedAt":"2026-10-24T00:11:20.000Z","summary":"Oct 24 , 00:11 UTC Resolved - The issue affecting Claude models has been resolved. Impact occurred from 16:28 PT / 23:28 UTC on October 23 to 16:59 PT / 23:59 UTC on October 23. Oct 23 , 23:54 UTC Monitoring - We are seeing success rates return to normal for all affected…"},{"id":"8730b37b22a9f0a6","title":"Elevated errors affecting Connectors","url":"https://status.claude.com/incidents/wj6r4t6mxq1r","publishedAt":"2026-10-22T08:07:03.000Z","summary":"Oct 22 , 08:07 UTC Resolved - The issue affecting claude.ai and Claude Cowork has been resolved. Oct 22 , 07:28 UTC Monitoring - A fix has been deployed for the issue affecting claude.ai and Claude Cowork and we are monitoring for recovery. Oct 22 , 03:50 UTC Investigating - We…"},{"id":"6bd8abd7149c3c31","title":"Degraded performance for Claude Fable 5","url":"https://status.claude.com/incidents/njk29r81v3wg","publishedAt":"2026-10-21T20:29:17.000Z","summary":"Oct 21 , 20:29 UTC Resolved - The issue affecting other Claude models has been resolved. Oct 21 , 19:49 UTC Investigating - We are investigating elevated errors on requests to Claude Fable 5. We will provide an update as soon as possible."}]}]}
